BOM.csv

Item,Qty,Supplier,Cost/item,Total Cost,link
ESP-32,1,Espessif,$6.30,$6.30,https://www.espressif.com/en/products/modules
Real-time Clock,1,Digikey,$10.43,$10.43,https://www.google.com/url?sa=t&rct=j&q=&esrc=s&source=web&cd=&cad=rja&uact=8&ved=2ahUKEwjo653o96yXAxVMRUEAHRS_LOIQFnoECB0QAQ&url=CAES3wEB6zswFa_IuduyNLsWiVlDJmLOzPSYRQqSSXNoVN08cnTfSHk1SJzYPJNAPr6bOSP5eg2Hz_AE7nGzIjDUD027gPtIgHIn3T7cOz-Ey8EYZZNfSmFRU6CGqviZVu8OpXo2fEV04-2cPCQ7AJJ9G2n_dSle8I4isnOuE46k73ryt3Uitz-t73WUQsLUSU0ubPj54fcOnI0tb-OaZ6DAZph9jp1KAHtlvyPc2YyOoseAsemaU-mOUsOgT3lUn6suQWFnpns9XFdzsyvyO3NH-b0zM-DBzCNabWLj1RZhguLh&uoh=2&usg=AOvVaw3WbrzH6EpTUkHhHsac7D7n&opi=89978449
Battery Charger,1,Amazon,$3.99,$3.99,https://www.google.com/url?sa=t&rct=j&q=&esrc=s&source=web&cd=&cad=rja&uact=8&ved=2ahUKEwic5rGh-KyXAxXkQEEAHUF6OccQFnoECCQQAQ&url=CAESYgHrOzAVOA1Q7a1mp5xb3IGl9FAd5kaNWNUfMWE2PBqlAl6PxHDyqLHOMT6X8zc0led_INcT5NIJtz8MRu6lfDmSB8Gj0AQsg3OAAYGUJp5ptUs9i3yXmgRmuQcskgsavDCE&uoh=2&usg=AOvVaw18yk3MRS_XQ2wBHUhc732S&opi=89978449
Voltage Regulator,1,Mouser Electronics UK,$0.24,$0.24,https://www.google.com/url?sa=t&rct=j&q=&esrc=s&source=web&cd=&cad=rja&uact=8&ved=2ahUKEwjRqZb--KyXAxW8X0EAHXZPBxsQFnoECB4QAQ&url=CAES6QEB6zswFZgWcnRd7GeR0GeNDaMR3nBkxy9tP78iNfQIwgtXW0A9BlFP_TPvf4Uk1XFjAKj-qiDjBNh1HkalqpXKe7MqtsMw5P3PDZmXJiHWYFm4foBiY3LtQVCEgPGHY7MbpmQ_7bFxOqBVYU2t68kYPdsy6k2pKwK4APP9h_emyrGrCRwpIHFe_TdkLfXfimlyMaPEfMNfb8cBk0WzWDYGPfvYh-wPF2uatNbGxTco6fURfDm2CLDfm1sNDBR-E7Gd_BrvAk6cz3z8KW_h01OWymqUxHCh-z3VYKLZmMyypHFxE2C42Gd43A&uoh=2&usg=AOvVaw22IwqX1dv05ZEjncRsBQY-&opi=89978449
Display Panel,1,The Pi Hut,$6.00,$6.00,https://www.google.com/url?sa=i&source=web&rct=j&url=CAESeAHrOzAVNpOc2pPD2-xFqZ7dRDUY_zaOSTVue5HJJVYdKt7XQPBJKhG5C03gcQh2vrspNfixxG99TzrvfB9-7K06YJVC6QoQ2q1se9T692N_WBZWaZwrODSDNP5Ue7XxtipaLPQ2w0xEHAa3r_5qvkL0gbMB0tedaQ&uoh=2&ved=2ahUKEwjTqbXn-ayXAxWzU0EAHf6dOwIQy_kOegoIAggACAAILRAD&opi=89978449&cd&psig=AOvVaw2JdD62KSo7aEEY5O3ai-b5&ust=1791635856078000
3.7V 500mAh LiPo Cell,1,Amazon,$1.99,$1.99,https://www.google.com/url?sa=i&rct=j&q=&esrc=s&source=web&cd=&cad=rja&uact=8&ved=0CHgQlesKahcKEwiIvoay-qyXAxUAAAAAHQAAAAAQCw&url=https%3A%2F%2Fwww.amazon.co.uk%2FBattery-Lithium-Magnification-Aircraft-Accessory%2Fdp%2FB0D6BQFMXW%3Fsource%3Dps-sl-shoppingads-lpcontext%26ref_%3Dfplfs%26psc%3D1%26smid%3DA2XNHZ7YIKJ0FP&psig=AOvVaw0gUSwjXkZz6-AnyqdFIpk0&ust=1791636004778137&opi=89978449
Estimated total shipping,1,,,$0.00,

README.md

# The-Astronomy-Files

BOM TAKEN FROM WHERE I INITIALLY HAD IT.
PART	QTY	UNIT	TOTAL	VENDOR	Actions
ESP-32
Primary MCU. Handles deep-sleep and Wi-Fi NTP/API quote fetching.
1	$6.30	$6.30	Espessif	
Real-time Clock
Keeps time tracking accurate to ±2 minutes per year, even if the main battery dies.
1	$10.43	$10.43	Digikey	
Battery Charger
Standard open-source friendly chip to safely manage 3.7V LiPo charging via USB.
1	$3.99	$3.99	Amazon	
Voltage Regulator
Steps down battery voltage to a stable 3.3V for the ESP32 and E-Paper panel.
1	$0.24	$0.24	Mouser Electronics UK	
Display Panel
Zero-power static state. Connects via SPI interface. Main screen.
1	$6.00	$6.00	The Pi Hut	
3.7V 500mAh LiPo Cell
Slim profile battery packed under the PCB board inside the pocket case.
1	$1.99	$1.99	Amazon